{
  "$schema": "../protocol/organism.schema.json",
  "protocol_version": 1,
  "identity": "seed",
  "install": ["npm", "ci", "--ignore-scripts"],
  "verify": ["npm", "run", "gate"],
  "start": ["npm", "start"],
  "health": {
    "path": "/healthz",
    "expected_status": 200,
    "startup_timeout_ms": 5000
  },
  "runtime": {
    "port_env": "PORT",
    "default_port": 3000
  }
}
